{
    "schemaVersion": 1,
    "replayId": "replay_018fcb7cff80721387a19b859e7c53a6",
    "sessionId": "session_018fcb7cff80721387a19b859e7c53a6",
    "chunkId": "chunk_000001",
    "sequence": 1,
    "startedAt": "2026-08-04T00:01:00.000Z",
    "endedAt": "2026-08-04T00:01:05.000Z",
    "codec": "elu-browser-dom-v1",
    "compression": "gzip",
    "contentEncoding": "base64",
    "payload": "H4sIAAAAAAACAwMAAAAAAAAAAAA=",
    "privacy": {
        "policyRevision": "privacy-1",
        "effectivePolicyHash": "sha256:852aa75195a8a72e48ded6f286ea8634d83e64c55277207756632f7a60883ed3",
        "appliedBeforeSerialization": true,
        "secureInputsMasked": true,
        "platformFallbackApplied": false
    },
    "versions": {
        "schemaVersion": 1,
        "contractVersion": "1.0.0",
        "platform": "browser",
        "runtime": {
            "name": "elu-js",
            "version": "1.409.5-elu.1"
        },
        "facade": {
            "name": "window.elu",
            "version": "1.0.0"
        },
        "build": "4670b69e98ed590c31cf42fc840a25bdadf45ae7"
    }
}
